{
  "schema": "recursive_watch_escalations_v1",
  "created_at": "2026-03-12T00:00:00Z",
  "caution": "Escalation indicates audit visibility/human review priority, not autonomy escalation.",
  "escalations": [
    {
      "threadId": "thread:coherence-lattice-001",
      "stabilityStatus": "stable",
      "auditStatus": "promote",
      "coherenceScore": 0.738253,
      "riskScore": 0.28,
      "persistenceScore": 0.79,
      "cognitiveWatchSignals": [
        "decreasing drift",
        "drift decreasing",
        "low contradiction",
        "multi-cycle persistence",
        "recursive candidate continuity",
        "stable multi-cycle coherence"
      ],
      "governingRule": "persistent-high-coherence-low-risk",
      "targetPublisherAction": "surface",
      "explanation": "Thread has remained coherent across repeated observations with controlled risk and drift. threadId=thread:coherence-lattice-001, stability=stable, coherence=0.738, risk=0.280, persistence=0.790."
    }
  ]
}
